Title,Description,Documents
Age Verification System,Implement age gates for users under 18 to comply with COPPA and state regulations,age_verification_specs.pdf
Location-Based Content Filtering,Block content based on user location to meet regional compliance requirements,geo_blocking_requirements.txt
User Profile Management,Basic user profile creation and management functionality,
Live Streaming Feature,Allow users to stream live video content to their followers,live_streaming_policy.pdf
E-commerce Integration,Enable users to purchase products directly through the platform,ecommerce_compliance.pdf
Content Recommendation Algorithm,AI-powered content recommendation system that personalizes user experience,algorithm_transparency_report.pdf
User-Generated Content Platform,Platform for users to upload and share their own content,ugc_guidelines.pdf
Advertising System,Targeted advertising system with user data analysis,advertising_policy.pdf
Data Analytics Dashboard,Analytics dashboard for tracking user behavior and platform metrics,analytics_privacy_policy.pdf
Social Media Sharing,Social media integration allowing users to share content across platforms,social_sharing_terms.pdf
Direct Messaging Feature,Private messaging system between users with end-to-end encryption,messaging_privacy_policy.pdf
Video Upload and Processing,Allow users to upload and process video content with automated moderation,video_upload_guidelines.pdf
Payment Processing System,Secure payment processing for in-app purchases and subscriptions,payment_compliance.pdf
Location Services,Location-based features including nearby content and location sharing,location_privacy_policy.pdf
Parental Controls,Parental control features for managing children's access to content,parental_controls_guide.pdf
Content Moderation Tools,Automated and manual content moderation system for inappropriate content,moderation_policy.pdf
Data Export Feature,Allow users to export their personal data in compliance with GDPR,data_export_guide.pdf
Cookie Consent Management,Manage user consent for cookies and tracking technologies,cookie_policy.pdf
Age-Restricted Content Filtering,Filter content based on age ratings and parental controls,age_restriction_policy.pdf
Geographic Data Localization,Store user data in specific geographic regions for compliance,data_localization_policy.pdf
